{
  "schemaVersion": 1,
  "id": "acs-og-kush-volatiles-2021",
  "publisher": "ACS Omega",
  "title": "Identification of a New Family of Prenylated Volatile Sulfur Compounds in Cannabis Revealed by Comprehensive Two-Dimensional Gas Chromatography",
  "url": "https://doi.org/10.1021/acsomega.1c04196",
  "sourceType": "scientificPublication",
  "supports": ["aromas", "terpenes"],
  "publishedAt": "2021-11-12",
  "checkedAt": "2026-08-16",
  "note": "Peer-reviewed volatile-compound study coauthored by Josh Del Rosso. It describes OG Kush as strongly pungent and fuel-like and associates that profile with high beta-myrcene and beta-caryophyllene. Used as corroboration, not as proof that every OG Kush lot shares one fixed terpene profile."
}
