{
  "schemaVersion": 1,
  "id": "humboldt-csi-wedding-cake-s1",
  "publisher": "Humboldt CSI",
  "title": "Wedding Cake S1",
  "url": "https://humboldtcsi.com/product/wedding-cake-s1/",
  "sourceType": "breederOfficial",
  "supports": ["lineage", "breeder", "generation", "origin"],
  "publishedAt": null,
  "checkedAt": "2026-08-16",
  "note": "Primary official source for the Wedding Cake S1 product name, Wedding Cake × Wedding Cake designation, feminized seed listing, and Humboldt CSI association. The page does not identify the exact Wedding Cake cut or provide cultivar-level aroma, terpene, or TYPE data."
}
