{"schemaVersion":1,"id":"dutch-passion-shaman","publisher":"Dutch Passion","title":"Shaman","url":"https://dutch-passion.com/en/cannabis-seeds/shaman","sourceType":"breederOfficial","supports":["lineage","breeder","classification","breeding","aromas"],"publishedAt":null,"checkedAt":"2026-08-17","note":"Dutch Passion official Shaman product page. Used for Purple #1 × Skunk lineage, sativa-dominant identity, F1/regular-feminised product context, aroma and visual colour evidence."}