{
  "schemaVersion":1,
  "id":"ghsc-super-lemon-haze",
  "publisher":"Green House Seed Co.",
  "title":"Super Lemon Haze",
  "url":"https://shop.greenhouseseeds.nl/feminised-cannabis-seeds/1-seed-pack/super-lemon-haze/?variation_id=26",
  "sourceType":"breederOfficial",
  "supports":["lineage","breeder","history"],
  "publishedAt":null,
  "checkedAt":"2026-08-14",
  "note":"Migrated from legacy sources.js without adding new claims."
}
