{
  "schemaVersion": 1,
  "id": "david-downs-wedding-cake-2026",
  "publisher": "David Downs / Fire Follower",
  "title": "Seed Junky Genetics recuts Wedding Cake into Cake Straws",
  "url": "https://daviddownspresents.substack.com/p/seed-junky-genetics-recuts-wedding",
  "sourceType": "specialistArticle",
  "supports": ["breeder", "lineage", "history", "aromas"],
  "publishedAt": "2026-07-17",
  "checkedAt": "2026-08-16",
  "note": "Recent specialist article based on direct conversation with Seed Junky co-founder J Beezy. It identifies Seed Junky Genetics with Wedding Cake and describes Wedding Cake as Triangle Kush x Animal Mints. The lineage wording is the author's statement rather than a verbatim lineage quote from J Beezy, so it is corroborating evidence rather than standalone A-level proof for parentage."
}
