{"schemaVersion":1,"id":"ace-seeds-about-2026","publisher":"ACE Seeds","title":"About us","url":"https://www.aceseeds.org/en/about-us/","sourceType":"breederOfficial","supports":["breeder","history"],"publishedAt":null,"checkedAt":"2026-08-17","note":"Current ACE Seeds official About page. Used to confirm Panama was included in ACE Seeds' first catalog in 2005 and to support breeder/seed-company context."}