{"schemaVersion":1,"id":"dutch-passion-shaman-story","publisher":"Dutch Passion","title":"Shaman cannabis strain story and grow tips","url":"https://dutch-passion.com/en/blog/shaman-cannabis-strain-story-and-grow-tips-n1294","sourceType":"breederOfficial","supports":["lineage","breeder","classification","breeding","history","origin","aromas"],"publishedAt":null,"checkedAt":"2026-08-17","note":"Dutch Passion official cultivar history page. Used for Purple #1 male × early Skunk female, sativa-dominant F1 designation, Dutch outdoor breeding-program history/origin and structural visual evidence."}